{
  "id": "task-w2-forge-f2f3",
  "title": "Build OpenClaw Spawner + Message Proxy",
  "description": "Execute F2/F3: implement agent lifecycle spawner service and /api/agents/:id/chat proxy endpoint.",
  "assignee": "forge",
  "priority": "P0",
  "track": "standard",
  "state": "completed",
  "createdAt": "2026-02-17T20:39:00+08:00",
  "createdBy": "kaiten-pulse",
  "updatedAt": "2026-02-18T11:45:51+08:00",
  "dueAt": "2026-02-17T23:30:00+08:00",
  "references": [
    "~/ocaas-project/coordination/SYSTEM-REVIEW-2026-02-17.md",
    "~/ocaas-project/coordination/SHARED-CONTEXT.md"
  ],
  "deliverables": [
    "Spawner service (start/stop/status)",
    "Port allocation + profile generation",
    "Message proxy endpoint",
    "Basic tests for lifecycle + chat"
  ],
  "blockers": [],
  "dependencies": [],
  "metadata": {
    "source": "legacy:inbox-forge.json"
  },
  "history": [
    {
      "state": "completed",
      "at": "2026-02-17T20:39:00+08:00",
      "by": "kaiten-pulse",
      "note": "Migrated from inbox-forge.json"
    }
  ]
}
